[
  {
    "type": "workstore.comic.template",
    "schemaVersion": 1,
    "templateId": "cat-workday",
    "revision": 3,
    "title": "猫咪打工记",
    "summary": "一只猫的职场日常，意外地闪闪发光。",
    "category": "日常反转",
    "style": "暖色手绘，柔和阳光，青绿色领带，橘猫圆框眼镜",
    "defaultPages": 6,
    "supportedCounts": [
      4,
      6,
      8
    ],
    "entities": [
      {
        "id": "entity-0",
        "name": "橘猫阿橘",
        "kind": "character",
        "description": "圆脸橘色虎斑猫，奶油色口鼻和肚皮，黑色圆框眼镜，青绿色领带，直立时约成人腰高",
        "locked": true,
        "reference": {
          "src": "/comics/cat-workday.png",
          "crop": [
            0.3333333333333333,
            0.0,
            0.3333333333333333,
            0.5
          ]
        }
      },
      {
        "id": "entity-1",
        "name": "主人小林",
        "kind": "character",
        "description": "蓬松深棕短发的年轻男子；早晨灰蓝睡衣，上班白衬衫，晚间深绿居家服",
        "locked": true,
        "reference": {
          "src": "/comics/cat-workday.png",
          "crop": [
            0.3333333333333333,
            0.5,
            0.3333333333333333,
            0.5
          ]
        }
      },
      {
        "id": "entity-2",
        "name": "家门口",
        "kind": "scene",
        "description": "棕色木门、黄褐色门垫、右侧绿色盆栽，暖米色墙壁",
        "locked": true,
        "reference": {
          "src": "/comics/cat-workday.png",
          "crop": [
            0.3333333333333333,
            0.0,
            0.3333333333333333,
            0.5
          ]
        }
      },
      {
        "id": "entity-3",
        "name": "公司工位",
        "kind": "scene",
        "description": "浅木桌、黑色显示器与键盘、青绿笔筒，大窗和背景绿植",
        "locked": true,
        "reference": {
          "src": "/comics/cat-workday.png",
          "crop": [
            0.6666666666666666,
            0.0,
            0.3333333333333333,
            0.5
          ]
        }
      },
      {
        "id": "entity-4",
        "name": "棕色公文包",
        "kind": "prop",
        "description": "深棕色方形皮质手提包，短提手、金色锁扣",
        "locked": true,
        "reference": {
          "src": "/comics/cat-workday.png",
          "crop": [
            0.3333333333333333,
            0.0,
            0.3333333333333333,
            0.5
          ]
        }
      }
    ],
    "beats": [
      "主人不想上班",
      "阿橘偷偷出门",
      "第一次坐到工位",
      "原来猫也很能干",
      "主人发现猫的秘密",
      "一起享受下班时光"
    ],
    "example": [
      {
        "id": "cat-workday-1",
        "title": "主人不想上班",
        "action": "主人不想上班",
        "dialogue": "你再睡一会儿，今天我来。",
        "entityIds": [
          "entity-0",
          "entity-1",
          "entity-2",
          "entity-3",
          "entity-4"
        ],
        "state": "第 1 个故事节拍，延续前页角色与道具状态",
        "image": {
          "src": "/comics/cat-workday.png",
          "crop": [
            0.0,
            0.0,
            0.3333333333333333,
            0.5
          ]
        },
        "status": "ready"
      },
      {
        "id": "cat-workday-2",
        "title": "阿橘偷偷出门",
        "action": "阿橘偷偷出门",
        "dialogue": "领带戴好，出发！",
        "entityIds": [
          "entity-0",
          "entity-1",
          "entity-2",
          "entity-3",
          "entity-4"
        ],
        "state": "第 2 个故事节拍，延续前页角色与道具状态",
        "image": {
          "src": "/comics/cat-workday.png",
          "crop": [
            0.3333333333333333,
            0.0,
            0.3333333333333333,
            0.5
          ]
        },
        "status": "ready"
      },
      {
        "id": "cat-workday-3",
        "title": "第一次坐到工位",
        "action": "第一次坐到工位",
        "dialogue": "这个键盘，和猫抓板差不多嘛。",
        "entityIds": [
          "entity-0",
          "entity-1",
          "entity-2",
          "entity-3",
          "entity-4"
        ],
        "state": "第 3 个故事节拍，延续前页角色与道具状态",
        "image": {
          "src": "/comics/cat-workday.png",
          "crop": [
            0.6666666666666666,
            0.0,
            0.3333333333333333,
            0.5
          ]
        },
        "status": "ready"
      },
      {
        "id": "cat-workday-4",
        "title": "原来猫也很能干",
        "action": "原来猫也很能干",
        "dialogue": "原来，我还挺擅长这个。",
        "entityIds": [
          "entity-0",
          "entity-1",
          "entity-2",
          "entity-3",
          "entity-4"
        ],
        "state": "第 4 个故事节拍，延续前页角色与道具状态",
        "image": {
          "src": "/comics/cat-workday.png",
          "crop": [
            0.0,
            0.5,
            0.3333333333333333,
            0.5
          ]
        },
        "status": "ready"
      },
      {
        "id": "cat-workday-5",
        "title": "主人发现猫的秘密",
        "action": "主人发现猫的秘密",
        "dialogue": "你……把我的工作都做完了？",
        "entityIds": [
          "entity-0",
          "entity-1",
          "entity-2",
          "entity-3",
          "entity-4"
        ],
        "state": "第 5 个故事节拍，延续前页角色与道具状态",
        "image": {
          "src": "/comics/cat-workday.png",
          "crop": [
            0.3333333333333333,
            0.5,
            0.3333333333333333,
            0.5
          ]
        },
        "status": "ready"
      },
      {
        "id": "cat-workday-6",
        "title": "一起享受下班时光",
        "action": "一起享受下班时光",
        "dialogue": "下班以后，我们都不用逞强。",
        "entityIds": [
          "entity-0",
          "entity-1",
          "entity-2",
          "entity-3",
          "entity-4"
        ],
        "state": "第 6 个故事节拍，延续前页角色与道具状态",
        "image": {
          "src": "/comics/cat-workday.png",
          "crop": [
            0.6666666666666666,
            0.5,
            0.3333333333333333,
            0.5
          ]
        },
        "status": "ready"
      }
    ],
    "cover": {
      "src": "/comics/cat-workday.png",
      "crop": [
        0.0,
        0.0,
        0.3333333333333333,
        0.5
      ]
    },
    "continuity": [
      "同一角色保持外貌、服装、比例一致",
      "道具变化需延续到后续页",
      "场景内物件位置和光线保持逻辑",
      "先确定完整剧情再绘制单页"
    ],
    "source": {
      "kind": "original",
      "author": "WorkStore",
      "redistribution": "WorkStore 原创策划与 AI 生成示例，可随模板分发",
      "referenceNotes": "示例图片由 AI 生成；角色服装按页内时间变化，持续出现的外观与场景保持一致。"
    },
    "narrativeByCount": {
      "4": [
        "主人疲惫，猫决定代班",
        "猫初到工位并尝试工作",
        "完成任务，主人发现秘密",
        "回家相伴，收回紧张情绪"
      ],
      "6": [
        "主人不想上班",
        "阿橘偷偷出门",
        "第一次坐到工位",
        "原来猫也很能干",
        "主人发现猫的秘密",
        "一起享受下班时光"
      ],
      "8": [
        "主人清晨赖床",
        "猫整理领带并拿起包",
        "经过家门前往公司",
        "初到工位感到紧张",
        "找到适合自己的工作办法",
        "展示成果得到认可",
        "主人到来发现秘密",
        "回到家一起休息"
      ]
    },
    "publishingDirection": "忠实于故事；突出角色的表情与情绪转折，标题简短，描述温暖自然",
    "dialogueStyle": {
      "shape": "speech",
      "position": "auto",
      "fill": "white",
      "rendering": "integrated",
      "lettering": "对白与绘画一体生成；手绘字形、气泡轮廓与作品画风协调，按发声关系和留白自适应排布，避开脸部、手部与关键动作，不固定横条"
    }
  },
  {
    "type": "workstore.comic.template",
    "schemaVersion": 1,
    "templateId": "dad-superpower",
    "revision": 3,
    "title": "爸爸的超能力",
    "summary": "平凡的爸爸，也有大大的超能力。",
    "category": "温暖治愈",
    "style": "温暖水彩绘本，柔和奶油色，亲子家庭日常",
    "defaultPages": 6,
    "supportedCounts": [
      4,
      6,
      8
    ],
    "entities": [
      {
        "id": "entity-0",
        "name": "爸爸",
        "kind": "character",
        "description": "黑色蓬松短发，米白针织毛衣，深色长裤，做饭时增加深蓝围裙",
        "locked": true,
        "reference": {
          "src": "/comics/dad-superpower.png",
          "crop": [
            0.3333333333333333,
            0.0,
            0.3333333333333333,
            0.5
          ]
        }
      },
      {
        "id": "entity-1",
        "name": "小米",
        "kind": "character",
        "description": "齐刘海深棕短发小女孩，黄色碎花短袖连衣裙，圆眼睛",
        "locked": true,
        "reference": {
          "src": "/comics/dad-superpower.png",
          "crop": [
            0.0,
            0.0,
            0.3333333333333333,
            0.5
          ]
        }
      },
      {
        "id": "entity-2",
        "name": "温暖的家",
        "kind": "scene",
        "description": "奶油色墙、浅木家具、绿植、蓝色布沙发和暖黄落地灯",
        "locked": true,
        "reference": {
          "src": "/comics/dad-superpower.png",
          "crop": [
            0.3333333333333333,
            0.5,
            0.3333333333333333,
            0.5
          ]
        }
      },
      {
        "id": "entity-3",
        "name": "玩具熊",
        "kind": "prop",
        "description": "棕色毛绒熊，圆耳、黑眼、浅棕口鼻；先手臂破损，缝好后完整，结尾有红色蝴蝶结",
        "locked": true,
        "reference": {
          "src": "/comics/dad-superpower.png",
          "crop": [
            0.6666666666666666,
            0.0,
            0.3333333333333333,
            0.5
          ]
        }
      }
    ],
    "beats": [
      "孩子遇到小难题",
      "爸爸总会及时出现",
      "一起修好小玩具",
      "爸爸变出一顿晚餐",
      "原来超人也会累",
      "孩子给爸爸一个拥抱"
    ],
    "example": [
      {
        "id": "dad-superpower-1",
        "title": "孩子遇到小难题",
        "action": "孩子遇到小难题",
        "dialogue": "小熊受伤了……",
        "entityIds": [
          "entity-0",
          "entity-1",
          "entity-2",
          "entity-3"
        ],
        "state": "第 1 个故事节拍，延续前页角色与道具状态",
        "image": {
          "src": "/comics/dad-superpower.png",
          "crop": [
            0.0,
            0.0,
            0.3333333333333333,
            0.5
          ]
        },
        "status": "ready"
      },
      {
        "id": "dad-superpower-2",
        "title": "爸爸总会及时出现",
        "action": "爸爸总会及时出现",
        "dialogue": "别怕，我们一起想办法。",
        "entityIds": [
          "entity-0",
          "entity-1",
          "entity-2",
          "entity-3"
        ],
        "state": "第 2 个故事节拍，延续前页角色与道具状态",
        "image": {
          "src": "/comics/dad-superpower.png",
          "crop": [
            0.3333333333333333,
            0.0,
            0.3333333333333333,
            0.5
          ]
        },
        "status": "ready"
      },
      {
        "id": "dad-superpower-3",